{
  "$schema": "../../schemas/norms.schema.json",
  "schemaVersion": 1,
  "doc": "СП 485.1311500.2020",
  "edition": "с изм. № 1 (введено с 01.01.2026) и № 2 (введено с 09.07.2026)",
  "title": "Узлы управления, промывочные устройства",
  "source": "sp-485.1311500.2020-s-izmeneniyami-n-1-2.docx, пп. 6.7.1.15, 6.8.2, 6.8.3, 6.8.5, 6.8.8, 6.7.2.10.",
  "verified": false,
  "records": [
    {
      "id": "sp485.p6_8_2.placement",
      "clause": "6.8.2",
      "values": {
        "minAirTemperature": 5
      },
      "units": {
        "minAirTemperature": "°С"
      },
      "note": "Узлы управления — в насосных станциях, помещениях пожарных постов, в защищаемых помещениях или вне их, с температурой воздуха 5 °С и выше и свободным доступом обслуживающего персонала."
    },
    {
      "id": "sp485.p6_8_3.enclosure",
      "clause": "6.8.3",
      "values": {
        "doorFireResistance": 30
      },
      "units": {
        "doorFireResistance": "мин (EI)"
      },
      "note": "Узлы управления в защищаемом помещении отделяют противопожарными перегородками 1-го типа, перекрытиями 3-го типа и дверьми не ниже EI 30; допускается размещение в специальных шкафах с доступом только обслуживающего персонала."
    },
    {
      "id": "sp485.p6_8_5.delay",
      "clause": "6.8.5",
      "values": {
        "min": 3,
        "max": 5
      },
      "units": {
        "min": "с",
        "max": "с"
      },
      "note": "Для исключения ложных срабатываний водозаполненных узлов управления допускается камера задержки перед сигнализатором давления или задержка выдачи сигнала."
    },
    {
      "id": "sp485.p6_8_8.platforms",
      "clause": "6.8.8",
      "values": {
        "heightAbove": 1.4,
        "fromPlatformMax": 1.0
      },
      "units": {
        "heightAbove": "м",
        "fromPlatformMax": "м"
      },
      "note": "При высоте до мест обслуживания запорных устройств более 1,4 м от пола — площадки или мостики, с них не более 1 м."
    },
    {
      "id": "sp485.p6_7_1_15.flushing",
      "clause": "6.7.1.15",
      "values": {
        "minDn": 50
      },
      "units": {
        "minDn": "DN"
      },
      "note": "Тупиковые, кольцевые и подводящие трубопроводы оборудуют промывочными заглушками (фланцами, кранами) не менее DN 50, при меньшем трубопроводе — его диаметра; в тупиковых — в конце участка, в кольцевых — в наиболее удалённом от ввода месте."
    },
    {
      "id": "sp485.p6_7_2_10.earthing",
      "clause": "6.7.2.10",
      "values": {
        "minPoints": 2
      },
      "units": {
        "minPoints": "шт."
      },
      "note": "Стальные трубопроводы присоединяют к контуру заземления в пределах одного помещения не менее чем в двух точках; трубопроводы, входящие в пожаро- и взрывоопасные помещения, заземляют перед вводом."
    },
    {
      "id": "sp485.p6_7_1_43.twoInputs",
      "clause": "6.7.1.43",
      "values": {
        "minControlUnits": 4,
        "maxHydrants": 12
      },
      "units": {
        "minControlUnits": "шт.",
        "maxHydrants": "шт."
      },
      "note": "АУП с четырьмя и более узлами управления и/или более 12 пожарными кранами — два ввода, подводящий трубопровод закольцован; вторым вводом в секцию АУП-С может быть обводная линия у узла управления с ручным запорным устройством."
    },
    {
      "id": "sp485.p6_7_1_45.hydrantConnection",
      "clause": "6.7.1.45",
      "values": {
        "minDn": 65
      },
      "units": {
        "minDn": "DN"
      },
      "note": "В ВПВ, совмещённом с АУП, ПК присоединяются: к водозаполненной спринклерной сети — к питающим и распределительным трубопроводам или их отводам; трубопроводы, к которым присоединяются ПК, — не менее DN 65 (ср. п. 6.1.22 — вопрос В-25)."
    },
    {
      "id": "sp485.p6_7_1_23.wallGap",
      "clause": "6.7.1.23",
      "values": {
        "minGap": 0.02,
        "aboveWindow": 0.5
      },
      "units": {
        "minGap": "м",
        "aboveWindow": "м"
      },
      "note": "Расстояние между трубопроводом и стенами — не менее 2 см; трубопроводы по стенам — на 0,5 м выше оконных проёмов."
    }
  ]
}
