{
  "$schema": "../../schemas/norms.schema.json",
  "schemaVersion": 1,
  "doc": "СП 6.13130.2025",
  "edition": "утв. приказом МЧС России от 29.12.2025 № 1263",
  "title": "Приложение Б (обязательное). Время работы СПЗ от АКБ для расчёта её ёмкости",
  "source": "Копия текста на сайте Болид (bolid.ru/files/551/729/SP6_13130.pdf, с. 33–34), не официальная публикация; сверить — open_questions.md, А-03",
  "verified": false,
  "records": [
    {
      "id": "sp6.b2.standbyTime",
      "clause": "прил. Б, п. Б.2",
      "values": {
        "t": 24
      },
      "units": {
        "t": "ч"
      },
      "note": "tд.р. в формуле Б.1 (и Б.1.1): время работы СПЗ от АКБ в дежурном режиме."
    },
    {
      "id": "sp6.b2.alarmTime",
      "clause": "прил. Б, п. Б.2",
      "values": {
        "t": 1
      },
      "units": {
        "t": "ч"
      },
      "note": "tр.п. в формуле Б.1 (и Б.1.1): время работы СПЗ от АКБ в режиме «Пожар». Коэффициенты Kн, Kстр и ток ИБЭ норма не задаёт — они из паспортов АКБ и ИБЭ."
    }
  ]
}
