{
  "$schema": "../../schemas/norms.schema.json",
  "schemaVersion": 1,
  "doc": "СП 485.1311500.2020",
  "edition": "с изм. № 1 (введено с 01.01.2026) и № 2 (введено с 09.07.2026)",
  "title": "Входные трубопроводы к пожарным насосам: несоосные переходы",
  "source": "sp-485.1311500.2020-s-izmeneniyami-n-1-2.docx, п. 6.7.1.22; рисунок 6.1 (изображение в таблице docx) — устройство несоосного перехода труб.",
  "verified": false,
  "columns": {
    "required": "признак требования: 1 — требование обязательно (числа в пункте нет), 0 — допускается не предусматривать (разрешение)"
  },
  "records": [
    {
      "id": "sp485.p6_7_1_22.eccentricReducers",
      "clause": "6.7.1.22",
      "values": {
        "required": 1
      },
      "units": {
        "required": "признак"
      },
      "attrs": {
        "kind": "requirement",
        "appliesTo": "входные трубопроводы к пожарным насосам",
        "figure": "6.1",
        "purpose": "исключение скапливания воздуха в трубопроводах"
      },
      "note": "Входные трубопроводы к пожарным насосам должны иметь несоосные переходы, выполненные согласно рисунку 6.1 (для исключения скапливания воздуха). Форма перехода задана рисунком; числа в пункте отсутствуют. Ориентация перехода (положение плоской образующей) в данных не зафиксирована — требует сверки с рисунком 6.1 специалистом: вопрос нормы."
    }
  ]
}
