{
  "$schema": "../../schemas/norms.schema.json",
  "schemaVersion": 1,
  "doc": "СП 7.13130.2013",
  "edition": "утв. приказом МЧС России от 21.02.2013 № 116",
  "title": "Управление вентиляцией при пожаре: отключение общеобменной, пуск противодымной, клапаны",
  "source": "Литература/АУПТ/Пожаротушение/01_Нормативы_РФ/СП 7.13130.2013.pdf, пп. 6.24, 7.19, 7.20, 7.22 (текст через PyMuPDF); действующая редакция с изменениями не сверена — open_questions.md, А-13.",
  "verified": false,
  "records": [
    {
      "id": "sp7.p7_20.supplyDelay",
      "clause": "7.20",
      "values": {
        "exhaustLeadMin": 20,
        "exhaustLeadMax": 30
      },
      "units": {
        "exhaustLeadMin": "с",
        "exhaustLeadMax": "с"
      },
      "note": "Управление противодымной вентиляцией — автоматическое (от АПС или АУП) и дистанционное (пульт диспетчера, кнопки у эвакуационных выходов или в пожарных шкафах). Вытяжная противодымная вентиляция включается с опережением приточной на 20–30 с; во всех вариантах — отключение общеобменной вентиляции и кондиционирования."
    },
    {
      "id": "sp7.p6_24.shutdown",
      "clause": "6.24",
      "values": {
        "required": 1
      },
      "units": {
        "required": "признак (1 — требуется)"
      },
      "note": "В зданиях с АУП и (или) АПС при пожаре автоматически отключаются общеобменная вентиляция, кондиционирование и воздушное отопление и закрываются противопожарные нормально открытые клапаны — по сигналам АУП и (или) АПС и при включении противодымной вентиляции. Частичное или полное отключение — по технологическим требованиям (решение раздела ОВ)."
    },
    {
      "id": "sp7.p7_19.damperHold",
      "clause": "7.19",
      "values": {
        "required": 1
      },
      "units": {
        "required": "признак (1 — требуется)"
      },
      "note": "Исполнительные механизмы противопожарных клапанов сохраняют заданное положение заслонки при отключении электропитания привода."
    },
    {
      "id": "sp7.p7_22.powerCategory",
      "clause": "7.22",
      "values": {
        "category": 1
      },
      "units": {
        "category": "категория надёжности электроснабжения"
      },
      "note": "Электроприёмники противодымной вентиляции — I категория; устройства автоматического отключения в цепях питания исполнительных элементов не допускаются."
    }
  ]
}
