{
  "$schema": "../../schemas/norms.schema.json",
  "schemaVersion": 1,
  "doc": "СП 485.1311500.2020",
  "edition": "с изм. № 1 (введено с 01.01.2026) и № 2 (введено с 09.07.2026)",
  "title": "Скорости в трубопроводах, автоматический водопитатель, наполнение резервуара",
  "source": "sp-485.1311500.2020-s-izmeneniyami-n-1-2.docx, пп. 6.7.1.37, 6.9.4, 6.9.12, 6.9.13.",
  "verified": false,
  "records": [
    {
      "id": "sp485.p6_7_1_37.velocity",
      "clause": "6.7.1.37",
      "values": {
        "pressureMax": 10,
        "suctionPositiveMax": 2.8,
        "suctionNegativeMax": 1.5
      },
      "units": {
        "pressureMax": "м/с",
        "suctionPositiveMax": "м/с",
        "suctionNegativeMax": "м/с"
      },
      "note": "Рекомендуемые скорости: напорные — до 10 м/с включительно; всасывающие — не более 2,8 м/с при положительном давлении на входе насоса и не более 1,5 м/с при уровне воды в резервуаре ниже оси насоса."
    },
    {
      "id": "sp485.p6_9_4.jockeyTank",
      "clause": "6.9.4",
      "values": {
        "minVolume": 40,
        "waterShareMin": 50,
        "waterShareMax": 60
      },
      "units": {
        "minVolume": "л",
        "waterShareMin": "%",
        "waterShareMax": "%"
      },
      "note": "Жокей-насос с промежуточной мембранной ёмкостью вместимостью не менее 40 л, вода — от 50 до 60 % вместимости."
    },
    {
      "id": "sp485.p6_9_12.minNetworkPressure",
      "clause": "6.9.12",
      "values": {
        "pressure": 0.05
      },
      "units": {
        "pressure": "МПа"
      },
      "note": "При давлении в наружной сети водопровода менее 0,05 МПа перед насосной установкой предусматривается пожарный резервуар."
    },
    {
      "id": "sp485.p6_9_13.tankFill",
      "clause": "6.9.13",
      "values": {
        "maxFill": 95
      },
      "units": {
        "maxFill": "%"
      },
      "note": "Заполнение пожарного резервуара водой — не более 95 % вместимости."
    }
  ]
}
