{
  "$schema": "../../schemas/norms.schema.json",
  "schemaVersion": 1,
  "doc": "СП 485.1311500.2020",
  "edition": "с изм. № 1 (введено с 01.01.2026) и № 2 (введено с 09.07.2026)",
  "clause": "табл. Б.3",
  "title": "Коэффициенты формул Б.7 (A = 10⁻⁸·α·Ø^−β) и Б.8 (Kт = 10⁻⁸·ψ·Ø^θ), DN 20–200; Ø — внутренний диаметр, мм",
  "source": "Таблица — sp-485.1311500.2020-s-izmeneniyami-n-1-2.docx и СП 485.1311500.2020.docx (числа совпадают). Формулы Б.7 и Б.8 — изображения в docx с изменениями.",
  "verified": false,
  "footnotes": {
    "B7": "С напечатанными α = 9,642, β = −5,300 и множителем 10⁻⁸ формула Б.7 не воспроизводит табл. Б.1; табличное A (0,0656 при Ø 34,75 мм) получается как 10⁶·9,642·Ø^−5,3. В расчёте Б.7 не используется: потери считаются через Kт (табл. Б.2 и Б.8).",
    "B8": "Б.8 воспроизводит Kт ГидРаВПТ для ВГП 42,3×4,0 (Ø 34,3 мм): 11,238334. Для строк табл. Б.2 значение таблицы и формулы различаются на единицы процентов (42,3×2,8: 16,5 и 16,21) — правило выбора см. open_questions.md В-04."
  },
  "records": [
    {
      "id": "sp485.tB_3.A.gost3262",
      "clause": "табл. Б.3",
      "values": {
        "alpha": 9.642,
        "beta": -5.3,
        "dnMin": 20,
        "dnMax": 200
      },
      "units": {
        "alpha": "—",
        "beta": "—",
        "dnMin": "DN",
        "dnMax": "DN"
      },
      "attrs": {
        "standard": "ГОСТ 3262",
        "formula": "Б.7",
        "quantity": "A"
      },
      "note": "Как напечатано; см. footnotes.B7."
    },
    {
      "id": "sp485.tB_3.Kt.gost3262",
      "clause": "табл. Б.3",
      "values": {
        "psi": 5.363,
        "theta": 5.42,
        "dnMin": 20,
        "dnMax": 200
      },
      "units": {
        "psi": "—",
        "theta": "—",
        "dnMin": "DN",
        "dnMax": "DN"
      },
      "attrs": {
        "standard": "ГОСТ 3262",
        "formula": "Б.8",
        "quantity": "Kt"
      }
    },
    {
      "id": "sp485.tB_3.Kt.gost10704",
      "clause": "табл. Б.3",
      "values": {
        "psi": 5.044,
        "theta": 5.434,
        "dnMin": 20,
        "dnMax": 200
      },
      "units": {
        "psi": "—",
        "theta": "—",
        "dnMin": "DN",
        "dnMax": "DN"
      },
      "attrs": {
        "standard": "ГОСТ 10704",
        "formula": "Б.8",
        "quantity": "Kt"
      }
    }
  ]
}
