{
  "$schema": "../../schemas/norms.schema.json",
  "schemaVersion": 1,
  "doc": "СП 485.1311500.2020",
  "edition": "с изм. № 1 (введено с 01.01.2026) и № 2 (введено с 09.07.2026)",
  "title": "ГОТВ: плотность паров и нормативные огнетушащие концентрации (прил. Г, табл. Г.1–Г.15)",
  "source": "sp-485.1311500.2020-s-izmeneniyami-n-1-2.docx, прил. Г; вид (сжиженный/сжатый) — по табл. 9.1.",
  "verified": false,
  "records": [
    {
      "id": "sp485.tG.nitrogen",
      "clause": "прил. Г, табл. Г.1",
      "values": {
        "density": 1.17,
        "heptane": 34.6,
        "ethanol": 36.0,
        "petrolA76": 33.8,
        "machineOil": 27.8
      },
      "units": {
        "density": "кг/м³ при 101,3 кПа и 20 °С",
        "heptane": "% (об.)",
        "ethanol": "% (об.)",
        "petrolA76": "% (об.)",
        "machineOil": "% (об.)"
      },
      "attrs": {
        "agent": "азот (N₂, IG100)",
        "kind": "compressed"
      },
      "note": "Концентрации — по горючим материалам: heptane — н-гептан (ГОСТ 25828); ethanol — этанол (ГОСТ Р 55878); petrolA76 — бензин А-76 (ГОСТ 2084); machineOil — масло машинное (ГОСТ 12337). Формула массы: Д.3 (сжатый газ или CO₂)."
    },
    {
      "id": "sp485.tG.argon",
      "clause": "прил. Г, табл. Г.2",
      "values": {
        "density": 1.66,
        "heptane": 39.0,
        "ethanol": 46.8,
        "petrolA76": 44.3,
        "machineOil": 36.1
      },
      "units": {
        "density": "кг/м³ при 101,3 кПа и 20 °С",
        "heptane": "% (об.)",
        "ethanol": "% (об.)",
        "petrolA76": "% (об.)",
        "machineOil": "% (об.)"
      },
      "attrs": {
        "agent": "аргон (Ar, IG01)",
        "kind": "compressed"
      },
      "note": "Концентрации — по горючим материалам: heptane — н-гептан (ГОСТ 25828); ethanol — этанол (ГОСТ Р 55878); petrolA76 — бензин А-76 (ГОСТ 2084); machineOil — масло машинное (ГОСТ 12337). Формула массы: Д.3 (сжатый газ или CO₂)."
    },
    {
      "id": "sp485.tG.co2",
      "clause": "прил. Г, табл. Г.3",
      "values": {
        "density": 1.88,
        "heptane": 34.9,
        "ethanol": 35.7,
        "acetone": 33.7,
        "toluene": 30.9,
        "isobutanol": 33.2,
        "kerosene": 32.6,
        "solvent646": 32.1
      },
      "units": {
        "density": "кг/м³ при 101,3 кПа и 20 °С",
        "heptane": "% (об.)",
        "ethanol": "% (об.)",
        "acetone": "% (об.)",
        "toluene": "% (об.)",
        "isobutanol": "% (об.)",
        "kerosene": "% (об.)",
        "solvent646": "% (об.)"
      },
      "attrs": {
        "agent": "двуокись углерода",
        "kind": "co2"
      },
      "note": "Концентрации — по горючим материалам: heptane — н-гептан (ГОСТ 25828); ethanol — этанол (ГОСТ Р 55878); acetone — ацетон технический (ГОСТ 2768); toluene — толуол (ГОСТ 5789); isobutanol — спирт изобутиловый (ГОСТ 6016); kerosene — керосин [7]; solvent646 — растворитель 646 (ГОСТ 18188). Формула массы: Д.3 (сжатый газ или CO₂)."
    },
    {
      "id": "sp485.tG.sf6",
      "clause": "прил. Г, табл. Г.4",
      "values": {
        "density": 6.474,
        "heptane": 10.0,
        "ethanol": 14.4,
        "acetone": 10.8,
        "transformerOil": 7.2
      },
      "units": {
        "density": "кг/м³ при 101,3 кПа и 20 °С",
        "heptane": "% (об.)",
        "ethanol": "% (об.)",
        "acetone": "% (об.)",
        "transformerOil": "% (об.)"
      },
      "attrs": {
        "agent": "шестифтористая сера",
        "kind": "liquefied"
      },
      "note": "Концентрации — по горючим материалам: heptane — н-гептан (ГОСТ 25828); ethanol — этанол (ГОСТ Р 55878); acetone — ацетон технический (ГОСТ 2768); transformerOil — трансформаторное масло (ГОСТ 982). Формула массы: Д.2 (сжиженный газ)."
    },
    {
      "id": "sp485.tG.hfc23",
      "clause": "прил. Г, табл. Г.5",
      "values": {
        "density": 2.93,
        "heptane": 14.6
      },
      "units": {
        "density": "кг/м³ при 101,3 кПа и 20 °С",
        "heptane": "% (об.)"
      },
      "attrs": {
        "agent": "хладон 23",
        "kind": "liquefied"
      },
      "note": "Концентрации — по горючим материалам: heptane — н-гептан (ГОСТ 25828). Формула массы: Д.2 (сжиженный газ)."
    },
    {
      "id": "sp485.tG.hfc125",
      "clause": "прил. Г, табл. Г.6",
      "values": {
        "density": 5.208,
        "heptane": 9.8,
        "ethanol": 11.7,
        "vacuumOil": 9.5
      },
      "units": {
        "density": "кг/м³ при 101,3 кПа и 20 °С",
        "heptane": "% (об.)",
        "ethanol": "% (об.)",
        "vacuumOil": "% (об.)"
      },
      "attrs": {
        "agent": "хладон 125",
        "kind": "liquefied"
      },
      "note": "Концентрации — по горючим материалам: heptane — н-гептан (ГОСТ 25828); ethanol — этанол (ГОСТ Р 55878); vacuumOil — вакуумное масло (ГОСТ 19678). Формула массы: Д.2 (сжиженный газ)."
    },
    {
      "id": "sp485.tG.hfc218",
      "clause": "прил. Г, табл. Г.7",
      "values": {
        "density": 7.85,
        "heptane": 7.2,
        "toluene": 5.4,
        "petrolA76": 6.7,
        "solvent647": 6.1
      },
      "units": {
        "density": "кг/м³ при 101,3 кПа и 20 °С",
        "heptane": "% (об.)",
        "toluene": "% (об.)",
        "petrolA76": "% (об.)",
        "solvent647": "% (об.)"
      },
      "attrs": {
        "agent": "хладон 218",
        "kind": "liquefied"
      },
      "note": "Концентрации — по горючим материалам: heptane — н-гептан (ГОСТ 25828); toluene — толуол (ГОСТ 5789); petrolA76 — бензин А-76 (ГОСТ 2084); solvent647 — растворитель 647 (ГОСТ 18188). Формула массы: Д.2 (сжиженный газ)."
    },
    {
      "id": "sp485.tG.hfc227ea",
      "clause": "прил. Г, табл. Г.8",
      "values": {
        "density": 7.28,
        "heptane": 7.2,
        "toluene": 6.0,
        "petrolA76": 7.3,
        "solvent647": 7.3
      },
      "units": {
        "density": "кг/м³ при 101,3 кПа и 20 °С",
        "heptane": "% (об.)",
        "toluene": "% (об.)",
        "petrolA76": "% (об.)",
        "solvent647": "% (об.)"
      },
      "attrs": {
        "agent": "хладон 227еа",
        "kind": "liquefied"
      },
      "note": "Концентрации — по горючим материалам: heptane — н-гептан (ГОСТ 25828); toluene — толуол (ГОСТ 5789); petrolA76 — бензин А-76 (ГОСТ 2084); solvent647 — растворитель 647 (ГОСТ 18188). Формула массы: Д.2 (сжиженный газ)."
    },
    {
      "id": "sp485.tG.hfc318c",
      "clause": "прил. Г, табл. Г.9",
      "values": {
        "density": 8.438,
        "heptane": 7.8,
        "ethanol": 7.8,
        "acetone": 7.2,
        "kerosene": 7.2,
        "toluene": 5.5
      },
      "units": {
        "density": "кг/м³ при 101,3 кПа и 20 °С",
        "heptane": "% (об.)",
        "ethanol": "% (об.)",
        "acetone": "% (об.)",
        "kerosene": "% (об.)",
        "toluene": "% (об.)"
      },
      "attrs": {
        "agent": "хладон 318Ц",
        "kind": "liquefied"
      },
      "note": "Концентрации — по горючим материалам: heptane — н-гептан (ГОСТ 25828); ethanol — этанол (ГОСТ Р 55878); acetone — ацетон технический (ГОСТ 2768); kerosene — керосин [7]; toluene — толуол (ГОСТ 5789). Формула массы: Д.2 (сжиженный газ)."
    },
    {
      "id": "sp485.tG.inergen",
      "clause": "прил. Г, табл. Г.10",
      "values": {
        "density": 1.42,
        "heptane": 36.5,
        "ethanol": 36.0,
        "machineOil": 28.3,
        "acetone": 37.2
      },
      "units": {
        "density": "кг/м³ при 101,3 кПа и 20 °С",
        "heptane": "% (об.)",
        "ethanol": "% (об.)",
        "machineOil": "% (об.)",
        "acetone": "% (об.)"
      },
      "attrs": {
        "agent": "«Инерген» (IG541)",
        "kind": "compressed"
      },
      "note": "Концентрации — по горючим материалам: heptane — н-гептан (ГОСТ 25828); ethanol — этанол (ГОСТ Р 55878); machineOil — масло машинное (ГОСТ 12337); acetone — ацетон технический (ГОСТ 2768). Формула массы: Д.3 (сжатый газ или CO₂)."
    },
    {
      "id": "sp485.tG.tfm18i",
      "clause": "прил. Г, табл. Г.11",
      "values": {
        "density": 3.24,
        "heptane": 9.5
      },
      "units": {
        "density": "кг/м³ при 101,3 кПа и 20 °С",
        "heptane": "% (об.)"
      },
      "attrs": {
        "agent": "ТФМ-18И",
        "kind": "liquefied"
      },
      "note": "Концентрации — по горючим материалам: heptane — н-гептан (ГОСТ 25828). Формула массы: Д.2 (сжиженный газ)."
    },
    {
      "id": "sp485.tG.fk5112",
      "clause": "прил. Г, табл. Г.12",
      "values": {
        "density": 13.6,
        "heptane": 5.4
      },
      "units": {
        "density": "кг/м³ при 101,3 кПа и 20 °С",
        "heptane": "% (об.)"
      },
      "attrs": {
        "agent": "ФК-5-1-12",
        "kind": "liquefied"
      },
      "note": "Концентрации — по горючим материалам: heptane — н-гептан (ГОСТ 25828). Формула массы: Д.2 (сжиженный газ)."
    },
    {
      "id": "sp485.tG.hfc217j1",
      "clause": "прил. Г, табл. Г.13",
      "values": {
        "density": 12.3,
        "heptane": 2.5
      },
      "units": {
        "density": "кг/м³ при 101,3 кПа и 20 °С",
        "heptane": "% (об.)"
      },
      "attrs": {
        "agent": "хладон 217J1",
        "kind": "liquefied"
      },
      "note": "Концентрации — по горючим материалам: heptane — н-гептан (ГОСТ 25828). Формула массы: Д.2 (сжиженный газ)."
    },
    {
      "id": "sp485.tG.argonite",
      "clause": "прил. Г, табл. Г.15",
      "values": {
        "density": 1.4,
        "heptane": 36.8
      },
      "units": {
        "density": "кг/м³ при 101,3 кПа и 20 °С",
        "heptane": "% (об.)"
      },
      "attrs": {
        "agent": "«Аргонит» (IG55)",
        "kind": "compressed"
      },
      "note": "Концентрации — по горючим материалам: heptane — н-гептан (ГОСТ 25828). Формула массы: Д.3 (сжатый газ или CO₂)."
    }
  ]
}
