{
  "$schema": "../../schemas/norms.schema.json",
  "schemaVersion": 1,
  "doc": "СП 3.13130.2026",
  "edition": "утв. приказом МЧС России от 26.02.2026 № 133, с 01.06.2026",
  "title": "СОУЭ: уровень звука, установка оповещателей, зоны, запуск, расчёт по прил. В",
  "source": "Текст приказа МЧС от 26.02.2026 № 133 (garant.ru/products/ipo/prime/doc/413717288, kontur-extern.ru normativ 500158), формулы В.1, В.2 — по изображениям; печатного PDF нет, страницы не указаны — open_questions.md, А-08.",
  "verified": false,
  "records": [
    {
      "id": "sp3.p6_8_2.soundLevel",
      "clause": "6.8.2",
      "values": { "aboveBackground": 15, "aboveBackgroundFlat": 10, "min": 65, "minFlat": 55, "loudBackground": 85, "loudMin": 105, "height": 1.5 },
      "units": { "aboveBackground": "дБ", "aboveBackgroundFlat": "дБ", "min": "дБА", "minFlat": "дБА", "loudBackground": "дБА", "loudMin": "дБА", "height": "м" },
      "note": "Сигнал выше постоянного шума не менее чем на 15 дБ (в квартирах — 10 дБ), но не ниже 65 дБА (квартиры — 55 дБА); измерение на 1,5 м от пола в любой точке при закрытых дверях. При фоне выше 85 дБА — не менее 105 дБА и обязательно световой и (или) тактильный способ."
    },
    {
      "id": "sp3.p6_8_4.soundMax",
      "clause": "6.8.4",
      "values": { "max": 110, "maxOther": 120 },
      "units": { "max": "дБА", "maxOther": "дБА" },
      "note": "Наибольший уровень от оповещателей — 110 дБА на 1,5 м; 120 дБА — в прочих доступных местах."
    },
    {
      "id": "sp3.p6_9_1.sleeping",
      "clause": "6.9.1",
      "values": { "min": 75, "max": 95, "aboveBackground": 15 },
      "units": { "min": "дБА", "max": "дБА", "aboveBackground": "дБ" },
      "note": "Спальные помещения: на уровне головы спящего 75–95 дБА и не менее чем на 15 дБ выше фона."
    },
    {
      "id": "sp3.p6_16_2.lightNotifier",
      "clause": "6.16.2",
      "values": { "maxHeightOnPath": 2.5, "wallHeightMin": 1.9, "wallHeightMax": 2.3, "maxDistance": 15, "perimeterStep": 30, "flashMin": 0.5, "flashMax": 2.0 },
      "units": { "maxHeightOnPath": "м", "wallHeightMin": "м", "wallHeightMax": "м", "maxDistance": "м", "perimeterStep": "м", "flashMin": "Гц", "flashMax": "Гц" },
      "note": "Световые оповещатели: в прямой видимости из любой точки не менее одного; высота не более 2,5 м по оси движения или на стенах 1,9–2,3 м; до самого удалённого места не более 15 м; в больших открытых пространствах — по периметру с шагом не более 30 м; вспышки 0,5–2 Гц (6.16.1), синхронные (6.16.3)."
    },
    {
      "id": "sp3.p6_18_1.mountHeight",
      "clause": "6.18.1",
      "values": { "minHeight": 2.3 },
      "units": { "minHeight": "м" },
      "note": "Звуковые, речевые, световые и комбинированные оповещатели — не ниже 2,3 м от пола до низа корпуса; ниже — только с защитой от повреждений и снятия (демонтаж инструментом)."
    },
    {
      "id": "sp3.p6_11_3.speech",
      "clause": "6.11.3",
      "values": { "maxBackground": 65, "aboveBackground": 10, "spacingOneWay": 6, "spacingTwoWay": 12, "intelligibleArea": 90 },
      "units": { "maxBackground": "дБА", "aboveBackground": "дБ", "spacingOneWay": "м", "spacingTwoWay": "м", "intelligibleArea": "%" },
      "note": "Речевое оповещение: фон не более 65 дБА, уровень сообщения на 1,5 м выше фона не менее чем на 10 дБ, между оповещателями не более 6 м (однонаправленные) и 12 м (двунаправленные); разборчивость на 90 % площади (6.11.1). Прил. В.7.4 для предварительных решений даёт 16 м между ОП и 8 м до слушателя — расхождение, А-08."
    },
    {
      "id": "sp3.p6_4_1.faultArea",
      "clause": "6.4.1",
      "values": { "maxArea": 2000, "systemErrorArea": 12000, "systemErrorAreaProtected": 48000 },
      "units": { "maxArea": "м²", "systemErrorArea": "м²", "systemErrorAreaProtected": "м²" },
      "note": "Единичная неисправность линии связи или питания — отказ оповещения не более 2000 м² одной зоны; системная ошибка ППУ — не более 12 000 м² (6.4.2), до 48 000 м² при защите от системной ошибки или аварийном микрофоне."
    },
    {
      "id": "sp3.p6_3_2.startDelay",
      "clause": "6.3.2",
      "values": { "maxStart": 10, "maxStartRadioBuilding": 32 },
      "units": { "maxStart": "с", "maxStartRadioBuilding": "с" },
      "note": "Автоматическая активация СОУЭ — не позже 10 с после сигнала СПС или АУП (радиоканал — 10 с в зоне, 32 с по зданию); при наличии СПС и АУП — раздельный запуск от каждой. Первой оповещается зона обнаружения (6.6.4); задержки для других зон при поэтапной эвакуации — по расчёту риска (6.6.2)."
    },
    {
      "id": "sp3.pB_3_4.voltageDrop",
      "clause": "прил. В, п. В.3.4",
      "values": { "maxDrop": 10 },
      "units": { "maxDrop": "% от номинального напряжения" },
      "note": "При отсутствии данных изготовителя падение напряжения в линиях оповещателей — не более 10 %."
    },
    {
      "id": "sp3.pB_formulas.attenuation",
      "clause": "прил. В, формулы В.1, В.2",
      "values": { "referenceDistance": 1, "distanceLawCoefficient": 20 },
      "units": { "referenceDistance": "м", "distanceLawCoefficient": "дБ на декаду расстояния" },
      "note": "В.1: L1 = S + 10·lg P — уровень на 1 м при мощности P (S — чувствительность, дБ при 1 Вт и 1 м). В.2: L2 = L1 + 20·lg(r1/r2), r1 = 1 м, r2 — расстояние до расчётной точки по лучу. Применимо при +5…+35 °С, без преград и отражений (В.6.2). Вне диаграммы направленности уровень обычно на 6 дБ ниже (В.4.2); при диапазоне уровня в паспорте берётся наименьший (В.3.5). Формулы суммирования нескольких оповещателей и запаса в приложении нет."
    },
    {
      "id": "sp3.pB_2_2.industrialMin",
      "clause": "прил. В, п. В.2.2",
      "values": { "minBackground": 60 },
      "units": { "minBackground": "дБА" },
      "note": "Для зданий Ф5 фон по заданию, но не ниже 60 дБА."
    },
    {
      "id": "sp3.p5_1_3.tolerance",
      "clause": "5.1.3",
      "values": { "maxIncrease": 5 },
      "units": { "maxIncrease": "%" },
      "note": "Численные значения свода правил могут быть увеличены не более чем на 5 % (кроме заданных с точностью или интервалами)."
    }
  ]
}
