{
  "$schema": "../../schemas/norms.schema.json",
  "schemaVersion": 1,
  "doc": "СП 485.1311500.2020",
  "edition": "с изм. № 1 (введено с 01.01.2026) и № 2 (введено с 09.07.2026)",
  "title": "Отдельные числа пунктов приложения Б",
  "source": "sp-485.1311500.2020-s-izmeneniyami-n-1-2.docx",
  "verified": false,
  "records": [
    {
      "id": "sp485.b1_3_13.localLossFactor",
      "clause": "Б.1.3.13",
      "values": {
        "localLossFactor": 0.2
      },
      "units": {
        "localLossFactor": "доля линейных потерь"
      },
      "note": "«Местные сопротивления (в том числе с учётом потерь в узле управления) принимают равным 20 % линейного сопротивления трубопроводов». Пояснение к Б.30 относит 20 % только к подводящему и питающему трубопроводу — к каким трубам применять, не решено: open_questions.md В-02, задача #9."
    },
    {
      "id": "sp485.b1_1_10.dictatingArea",
      "clause": "Б.1.1.10",
      "values": {
        "s": 12
      },
      "units": {
        "s": "м²"
      },
      "note": "Круговая площадь диктующего оросителя (R = 2 м); используется в Б.1: q = (1,3…1,5)·i·s."
    },
    {
      "id": "sp485.b1_1_12.dictatingFlowFactor",
      "clause": "Б.1.1.12",
      "values": {
        "min": 1.3,
        "max": 1.5
      },
      "units": {
        "min": "—",
        "max": "—"
      },
      "note": "Формула Б.1: q = (1,3…1,5)·i·s — ориентировочный расход диктующего оросителя при отсутствии эпюр и паспортных данных. Какой множитель брать — open_questions.md В-08; расчёт программы берёт верхний (строже)."
    },
    {
      "id": "sp485.b1_2_6.diameter",
      "clause": "Б.1.2.6",
      "values": {
        "muMin": 0.9,
        "muMax": 0.95,
        "velocityMax": 10
      },
      "units": {
        "muMin": "—",
        "muMax": "—",
        "velocityMax": "м/с"
      },
      "note": "Формула Б.5: d = 1000·√(4Q / (π·μ·V)); μ — коэффициент расхода (при отсутствии данных 0,90–0,95), V — скорость, не более 10 м/с. Расчёт программы берёт μ = 0,90 (больший диаметр)."
    }
  ]
}
